{
  "schema_name": "phase2_year_themes_chapter",
  "schema_version": "1.0",
  "package_type": "year_themes_chapter_package",
  "book_title": "Trump Chronicles",
  "chapter_title": "The Twelve Key Themes of the Year",
  "chapter_subtitle": null,
  "build": {
    "created_at": "2026-03-16T02:45:31Z",
    "created_by": "build_year_themes_chapter.py",
    "model": null,
    "run_id": "year-themes-20260316T024531Z-f4c25512",
    "prompt_version": "year-themes-chapter-v1",
    "git_commit": null
  },
  "generated_from": {
    "timeline_by_week_file": "/Volumes/PRINTIFY24/Democracy Clock Automation/Trump Diary/10_BackMatter/timeline_by_week.json",
    "key_themes_file": "/Volumes/PRINTIFY24/Democracy Clock Automation/Trump Diary/10_BackMatter/key_themes.json",
    "source_week_range": {
      "start_week": 1,
      "end_week": 53
    },
    "notes": [
      "This package is for a main-body synthesis chapter, not back matter.",
      "Illustrative weeks are prompts for narrative emphasis, not exhaustive citations.",
      "The chapter should read as one integrated essay with twelve subsections."
    ]
  },
  "chapter_brief": {
    "purpose": "To synthesize the recurring governing patterns revealed by fifty-three weeks of chronology and show that the year was not merely a sequence of controversies but a coherent style of rule.",
    "placement": "Place after Week 53 and before back matter.",
    "opening_brief": "Open by explaining what year-scale chronology reveals that daily coverage often misses: recurrence, reinforcement, and governing method. Establish that the twelve themes are not isolated topics but overlapping patterns that became unmistakable only when the weeks were allowed to accumulate.",
    "opening_targets": [
      "Explain why chronology matters.",
      "Frame the year as patterned rather than random.",
      "Prepare the reader to expect overlap among themes.",
      "State that repetition itself is part of the story."
    ],
    "tone_notes": [
      "Interpretive, not academic.",
      "Calm, authoritative, and cumulative.",
      "Avoid melodrama and sloganizing.",
      "Sound like a concluding book chapter, not an appendix.",
      "Use the year’s accumulation to create force."
    ],
    "word_count_target": {
      "opening_min": 400,
      "opening_max": 700,
      "section_min": 150,
      "section_max": 250,
      "closing_min": 300,
      "closing_max": 500,
      "chapter_min": 2500,
      "chapter_max": 4200
    }
  },
  "themes": [
    {
      "theme_id": "THEME_EXECUTIVE_OVERREACH",
      "theme_name": "Executive Overreach",
      "sort_order": 1,
      "section_role": "Establish the central governing instinct of the year: the repeated attempt to enlarge executive reach beyond ordinary democratic restraint.",
      "framing_line": "The recurrent use of unilateral executive action to outrun deliberation, oversight, and normal institutional process.",
      "section_brief": "Show that overreach was not one isolated constitutional dispute but a recurring operating habit. Emphasize unilateral directives, emergency-style reasoning, appropriation conflicts, administrative repurposing, and the repeated effort to act first while forcing Congress, the courts, and the public to respond after the fact.",
      "recurring_forms": [
        {
          "form_id": "FORM_CIRCUMVENTION_OF_OVERSIGHT",
          "form_name": "Circumvention of Oversight",
          "form_description": "Weakening, sidelining, or bypassing Congress, inspectors general, reporting duties, or public scrutiny."
        },
        {
          "form_id": "FORM_EMERGENCY_OR_EXCEPTIONAL_POWERS",
          "form_name": "Emergency or Exceptional Powers",
          "form_description": "Invoking crisis, invasion, national security, or extraordinary necessity to enlarge executive latitude."
        },
        {
          "form_id": "FORM_USURPATION_OF_OTHER_POWERS",
          "form_name": "Usurpation of Other Powers",
          "form_description": "Asserting powers assigned to Congress, the courts, independent agencies, or the states."
        },
        {
          "form_id": "FORM_ADMINISTRATIVE_COMMANDEERING",
          "form_name": "Administrative Commandeering",
          "form_description": "Repurposing agencies, budgets, hiring systems, classifications, or internal procedures for political control."
        },
        {
          "form_id": "FORM_AFTER_THE_FACT_GOVERNANCE",
          "form_name": "After-the-Fact Governance",
          "form_description": "Acting first, then forcing institutions to respond after the decision has already changed facts on the ground."
        }
      ],
      "illustrative_weeks": [
        {
          "week": 1,
          "why_it_matters": "The opening burst of executive action established the year’s recurring preference for unilateral movement before institutional review could catch up."
        },
        {
          "week": 3,
          "why_it_matters": "Appropriation conflicts, agency repurposing, and rapid administrative intervention made executive centralization unmistakable."
        },
        {
          "week": 12,
          "why_it_matters": "By this point the pattern was no longer episodic; acting first and forcing others to respond had become method."
        },
        {
          "week": 27,
          "why_it_matters": "Midyear developments showed how executive overreach could migrate across domains rather than remain confined to one policy field."
        },
        {
          "week": 44,
          "why_it_matters": "Later episodes demonstrated that repetition had hardened unilateral action into a governing norm rather than an opening shock."
        }
      ],
      "bridge_forward": "That overreach rarely operated alone. It depended on who could enter the state, who could staff it, and whose interests the machinery of government increasingly served.",
      "notes": []
    },
    {
      "theme_id": "THEME_EXECUTIVE_PRIVATE_FUSION",
      "theme_name": "Executive–Private Fusion",
      "sort_order": 2,
      "section_role": "Show that state power was not only centralized but increasingly entangled with private influence and unofficial actors.",
      "framing_line": "Private actors, business interests, and loyalist networks became embedded in state power rather than kept at arm’s length from it.",
      "section_brief": "Explain how the year blurred the boundary between public authority and private leverage: outside actors inside state functions, patronage logic, informal channels of influence, and quasi-outsourced control. Stress that the democratic danger lies not only in corruption narrowly understood, but in the erosion of accountable state structure.",
      "recurring_forms": [
        {
          "form_id": "FORM_PRIVATE_ACTORS_INSIDE_STATE_FUNCTIONS",
          "form_name": "Private Actors Inside State Functions",
          "form_description": "Unofficial or thinly supervised private operatives gain access to government machinery, data, or decision channels."
        },
        {
          "form_id": "FORM_PATRONAGE_AND_SELF_DEALING",
          "form_name": "Patronage and Self-Dealing",
          "form_description": "Public decisions track private advantage, donor networks, or personal loyalties rather than public purpose."
        },
        {
          "form_id": "FORM_INFORMAL_POWER_CHANNELS",
          "form_name": "Informal Power Channels",
          "form_description": "Influence flows through ad hoc relationships, personal networks, and opaque side channels rather than ordinary accountability structures."
        },
        {
          "form_id": "FORM_OUTSOURCED_COERCION_OR_CONTROL",
          "form_name": "Outsourced Coercion or Control",
          "form_description": "State functions are effectively outsourced to actors whose authority is unclear but whose influence is real."
        }
      ],
      "illustrative_weeks": [
        {
          "week": 3,
          "why_it_matters": "The week made the merger of private influence and public machinery unusually visible, especially in access to core state functions and data."
        },
        {
          "week": 9,
          "why_it_matters": "Private leverage ceased to look exceptional and began to appear as a recurring mode of governance."
        },
        {
          "week": 22,
          "why_it_matters": "By this stage, informal channels and quasi-official actors had become a recognizable structural feature rather than an anomaly."
        },
        {
          "week": 38,
          "why_it_matters": "Later developments showed how difficult it had become to distinguish public purpose from private advantage."
        }
      ],
      "bridge_forward": "Once public and private power blur, the law itself becomes easier to bend — not only in who is protected, but in what enforcement is for.",
      "notes": []
    },
    {
      "theme_id": "THEME_RULE_OF_LAW_INVERSION",
      "theme_name": "Rule-of-Law Inversion",
      "sort_order": 3,
      "section_role": "Explain how legality itself was rhetorically and institutionally turned upside down.",
      "framing_line": "Independent enforcement was recast as partisan abuse while allies were shielded and opponents were targeted.",
      "section_brief": "Show that the issue was not just legal controversy, but inversion: allies protected, opponents targeted, corruption control reframed as persecution, and enforcement redirected by grievance and loyalty. Make clear that this challenged the premise that law should stand above the ruler rather than serve him.",
      "recurring_forms": [
        {
          "form_id": "FORM_PROTECTION_OF_ALLIES",
          "form_name": "Protection of Allies",
          "form_description": "Pardons, non-enforcement, personnel shielding, or selective lenience for loyalists and politically useful actors."
        },
        {
          "form_id": "FORM_TARGETING_OF_OPPONENTS",
          "form_name": "Targeting of Opponents",